{
  "$schema": "https://json-schema.org/draft/2020-12/schema",
  "$id": "xanathar-livello-meccanico-schema-1.0.0",
  "title": "Xanathar Mechanical Overlay",
  "type": "object",
  "required": [
    "meta",
    "automation_levels",
    "resource_pools",
    "mechanics",
    "runtime_contract",
    "validation"
  ],
  "properties": {
    "meta": {
      "type": "object"
    },
    "automation_levels": {
      "type": "object"
    },
    "external_resource_pools": {
      "type": "array"
    },
    "resource_pools": {
      "type": "array",
      "items": {
        "type": "object",
        "required": [
          "id",
          "nome",
          "owner",
          "kind"
        ]
      }
    },
    "mechanics": {
      "type": "array",
      "items": {
        "type": "object",
        "required": [
          "id",
          "catalog_ref",
          "source",
          "automation_level",
          "activation",
          "targets",
          "duration",
          "resource_costs",
          "effects",
          "runtime_requirements",
          "completeness"
        ]
      }
    },
    "runtime_contract": {
      "type": "object"
    },
    "validation": {
      "type": "object"
    }
  }
}