{
  "meta": {
    "titolo": "Livello meccanico supplementare - Ranger (Revised)",
    "sistema": "D&D 5e 2014 - Unearthed Arcana",
    "lingua": "it-IT",
    "versione": "1.0.0",
    "versione_schema": "1.1.0",
    "data_generazione": "2026-08-02",
    "base_catalog_file": "ranger_revised_database_finale.json",
    "base_phb_mechanics_file": "phb2014_livello_meccanico_v1_1.json",
    "descrizione": "Overlay meccanico per la classe Ranger (Revised), i tre conclavi e tutte le opzioni selezionabili. Tutti i record sono stati strutturati manualmente dalla fonte UA; le capacità che richiedono decisioni o dati del mondo sono marcate come assistite o di tracciamento."
  },
  "automation_levels": {
    "riferimento": "Mostra testo e metadati; nessuna automazione.",
    "tracciamento": "Gestisce scelte, stato o disponibilità senza applicare automaticamente effetti al combattimento.",
    "assistita": "Propone o applica gli effetti soltanto dopo una scelta o conferma del giocatore/DM.",
    "automatica": "Effetto deterministico applicabile dal runtime quando tutti i dati richiesti sono disponibili."
  },
  "external_resource_pools": [
    "slot-incantesimo-standard-aggregati"
  ],
  "resource_pools": [],
  "mechanics": [
    {
      "id": "ranger-revised-nemico-prescelto",
      "catalog_ref": {
        "collection": "privilegi",
        "id": "ranger-revised-nemico-prescelto"
      },
      "source": {
        "name": "Nemico Prescelto",
        "original_name": "Favored Enemy",
        "class_id": "ranger-revised",
        "subclass_id": null,
        "parent_id": null,
        "levels": [
          1
        ],
        "page": 2,
        "description_hash_sha256": "d7c5784535c5aedf13b69aa857a6fda5e8139bfe3af9eb3a4c5c9eca91f21322"
      },
      "automation_level": "assistita",
      "activation": {
        "primary": "passiva",
        "alternatives": [],
        "trigger": null,
        "timing": null,
        "optional": false
      },
      "triggers_detected": [],
      "targets": {
        "type": "non_specificato",
        "range_meters": null,
        "additional_ranges_meters": [],
        "origin": null,
        "requirements": [],
        "excluded_types": []
      },
      "duration": {
        "type": "non_specificata",
        "value": null,
        "unit": null,
        "max_rounds": null,
        "formula": null,
        "end_conditions": []
      },
      "resource_costs": [],
      "effects": [
        {
          "type": "configuration_choice",
          "field": "favored_enemy_type",
          "allowed": [
            "bestie",
            "folletti",
            "umanoidi",
            "mostruosità",
            "non morti"
          ],
          "count": 1
        },
        {
          "type": "bonus_damage",
          "value": 2,
          "damage_roll": "weapon_attack",
          "condition": "target.type == feature_state.favored_enemy_type"
        },
        {
          "type": "advantage",
          "roll": "Saggezza (Sopravvivenza)",
          "condition": "tracking favored enemy"
        },
        {
          "type": "advantage",
          "roll": "Intelligenza",
          "condition": "recalling information about favored enemy"
        },
        {
          "type": "learn_language",
          "count": 1
        }
      ],
      "effect_tags": [
        "danni_extra",
        "vantaggio",
        "linguaggio"
      ],
      "runtime_requirements": [
        "target_creature_type",
        "feature_choice:favored_enemy_type"
      ],
      "manual_choice_required": true,
      "completeness": {
        "status": "curated",
        "review_required": false,
        "missing_for_execution": []
      }
    },
    {
      "id": "ranger-revised-esploratore-nato",
      "catalog_ref": {
        "collection": "privilegi",
        "id": "ranger-revised-esploratore-nato"
      },
      "source": {
        "name": "Esploratore Nato",
        "original_name": "Natural Explorer",
        "class_id": "ranger-revised",
        "subclass_id": null,
        "parent_id": null,
        "levels": [
          1
        ],
        "page": 3,
        "description_hash_sha256": "000b61d6e04401d0164f668bd8c6aab47b81e7382b23f65e60c6c13689a6d89e"
      },
      "automation_level": "assistita",
      "activation": {
        "primary": "passiva",
        "alternatives": [],
        "trigger": null,
        "timing": null,
        "optional": false
      },
      "triggers_detected": [],
      "targets": {
        "type": "non_specificato",
        "range_meters": null,
        "additional_ranges_meters": [],
        "origin": null,
        "requirements": [],
        "excluded_types": []
      },
      "duration": {
        "type": "non_specificata",
        "value": null,
        "unit": null,
        "max_rounds": null,
        "formula": null,
        "end_conditions": []
      },
      "resource_costs": [],
      "effects": [
        {
          "type": "ignore_difficult_terrain",
          "scope": "self"
        },
        {
          "type": "advantage",
          "roll": "initiative"
        },
        {
          "type": "advantage",
          "roll": "attack",
          "condition": "first_turn_of_combat && target.has_not_acted"
        },
        {
          "type": "travel_rule_bundle",
          "id": "revised_ranger_natural_explorer_travel"
        }
      ],
      "effect_tags": [
        "terreno_difficile",
        "iniziativa",
        "vantaggio",
        "viaggio"
      ],
      "runtime_requirements": [
        "combat_round_state",
        "target_turn_state"
      ],
      "manual_choice_required": false,
      "completeness": {
        "status": "curated",
        "review_required": false,
        "missing_for_execution": []
      }
    },
    {
      "id": "ranger-revised-stile-di-combattimento",
      "catalog_ref": {
        "collection": "privilegi",
        "id": "ranger-revised-stile-di-combattimento"
      },
      "source": {
        "name": "Stile di Combattimento",
        "original_name": "Fighting Style",
        "class_id": "ranger-revised",
        "subclass_id": null,
        "parent_id": null,
        "levels": [
          2
        ],
        "page": 3,
        "description_hash_sha256": "e4bab321cbce0026cfce48da8aa4ab3d1857a95f862e77942f2ac5122ca4619f"
      },
      "automation_level": "tracciamento",
      "activation": {
        "primary": "passiva",
        "alternatives": [],
        "trigger": null,
        "timing": null,
        "optional": false
      },
      "triggers_detected": [],
      "targets": {
        "type": "non_specificato",
        "range_meters": null,
        "additional_ranges_meters": [],
        "origin": null,
        "requirements": [],
        "excluded_types": []
      },
      "duration": {
        "type": "non_specificata",
        "value": null,
        "unit": null,
        "max_rounds": null,
        "formula": null,
        "end_conditions": []
      },
      "resource_costs": [],
      "effects": [
        {
          "type": "choose_option",
          "from_parent": "ranger-revised-stile-di-combattimento",
          "count": 1,
          "unique": true
        }
      ],
      "effect_tags": [
        "scelta_permanente"
      ],
      "runtime_requirements": [],
      "manual_choice_required": true,
      "completeness": {
        "status": "curated",
        "review_required": false,
        "missing_for_execution": []
      }
    },
    {
      "id": "ranger-revised-incantesimi",
      "catalog_ref": {
        "collection": "privilegi",
        "id": "ranger-revised-incantesimi"
      },
      "source": {
        "name": "Incantesimi",
        "original_name": "Spellcasting",
        "class_id": "ranger-revised",
        "subclass_id": null,
        "parent_id": null,
        "levels": [
          2
        ],
        "page": 3,
        "description_hash_sha256": "ee766ecb2e49a9969f733a7fafc7c9949465a65d0dad0fc93ca88591d37ba5a4"
      },
      "automation_level": "tracciamento",
      "activation": {
        "primary": "passiva",
        "alternatives": [],
        "trigger": null,
        "timing": null,
        "optional": false
      },
      "triggers_detected": [],
      "targets": {
        "type": "non_specificato",
        "range_meters": null,
        "additional_ranges_meters": [],
        "origin": null,
        "requirements": [],
        "excluded_types": []
      },
      "duration": {
        "type": "non_specificata",
        "value": null,
        "unit": null,
        "max_rounds": null,
        "formula": null,
        "end_conditions": []
      },
      "resource_costs": [],
      "effects": [
        {
          "type": "spellcasting_progression",
          "class_id": "ranger-revised",
          "ability": "Saggezza",
          "known_spells_field": "incantesimi_conosciuti",
          "slot_pool_id": "slot-incantesimo-standard-aggregati"
        },
        {
          "type": "spell_save_dc",
          "formula": "8 + bonus_competenza + modificatore_saggezza"
        },
        {
          "type": "spell_attack_modifier",
          "formula": "bonus_competenza + modificatore_saggezza"
        }
      ],
      "effect_tags": [
        "incantesimi",
        "slot_incantesimo"
      ],
      "runtime_requirements": [
        "character_build",
        "spell_catalog"
      ],
      "manual_choice_required": false,
      "completeness": {
        "status": "curated",
        "review_required": false,
        "missing_for_execution": []
      },
      "recovery": [
        "riposo_lungo"
      ]
    },
    {
      "id": "ranger-revised-consapevolezza-primordiale",
      "catalog_ref": {
        "collection": "privilegi",
        "id": "ranger-revised-consapevolezza-primordiale"
      },
      "source": {
        "name": "Consapevolezza Primordiale",
        "original_name": "Primeval Awareness",
        "class_id": "ranger-revised",
        "subclass_id": null,
        "parent_id": null,
        "levels": [